week_ending,week_number,weekly_gross_overall,show,theatre,weekly_gross,potential_gross,avg_ticket_price,top_ticket_price,seats_sold,seats_in_theatre,pct_capacity,performances,previews,synopsis,start_date
2002-09-29,18,11848117.0,Flower Drum Song,Virginia Theatre,495567.0,719073.0,65.72,96.0,7541,1214,0.8874,0,7,"A traditional Chinese bride is brought to San Francisco to marry an assimilating son who exasperates his old-world father by chasing after an Americanized nightclub singer, in Rodgers and Hammerstein's musical adaptation of C.Y. Lee's novel.",
2002-10-06,19,12282283.0,Movin' Out,Richard Rodgers Theatre,645921.0,810163.0,73.08,95.0,8838,1322,0.8357,0,8,"Billy Joel's songs and Twyla Tharp's choreography illustrate the story of five friends and lovers as they go through three decades of love, war and loss.",
2002-10-13,20,13828498.0,Hollywood Arms,Cort Theatre,188619.0,449830.0,37.68,76.25,5006,1071,0.5843,0,8,A young daughter of ineffectual parents finds escape and solace in her own dreams of stardom. Veteran actress Carol Burnett and her daughter Carrie Hamilton co-wrote this fictionalized dramatization of Burnett's childhood in Hollywood.,
2002-10-13,20,13828498.0,Prune Danish,Royale Theatre,255570.0,487335.0,59.43,76.25,4300,1101,0.5579,0,7,"Jackie Mason takes on neckties, President Bill Clinton, Ariel Sharon and more in this evening of comedy.",
2002-10-20,21,14247900.0,Dance of the Vampires,Minskoff Theatre,508133.0,639408.0,62.74,95.0,8099,1677,0.9659,0,5,"This campy musical, based on the Roman Polanski film The Fearless Vampire Killers, follows Professor Abronsius and his bumbling assistant Alfred as they attempt to prove the existence of vampires in Transylvania. Alfred falls for innkeeper's daughter Sarah, unaware that she is being pursued by the mysterious Count von Krolock.",
2002-11-03,23,12752483.0,Russell Simmons Def Poetry Jam,Longacre Theatre,52164.0,197761.0,25.48,31.25,2047,1094,0.2673,0,7,"Russell Simmons produces an evening showcasing nine hip-hop poets, who present their unique, stylistic takes on love, everyday life and more.",
2002-11-24,26,13625257.0,Dinner at Eight,Vivian Beaumont Theater,28721.0,74220.0,44.39,70.0,647,1089,0.5941,0,1,"A couple in financial trouble invite a variety of socially prominent, social-climbing and socially fading characters to a dinner party at their home.",
2002-12-01,27,17796411.0,Imaginary Friends,Ethel Barrymore Theatre,220886.0,631894.0,60.95,91.25,3624,1066,0.425,0,8,"Imaginary Friends concerns real-life literary rivals Lillian Hellman and Mary McCarthy, two women who barely knew each other yet became bitter enemies and legal adversaries. As a guest on The Dick Cavett Show in 1980, McCarthy famously said of Hellman, ""Every word she writes is a lie, including and and the.""  Their feud is examined as a ""play with music,"" written by Nora Ephron and featuring songs by Marvin Hamlisch and Craig Carnelia.",
2002-12-01,27,17796411.0,La Boheme,Broadway Theatre,439584.0,614962.0,71.89,96.25,6115,1697,0.7207,0,5,"A group of bohemian artists struggle to survive the cold Paris winter, as romance between poet Rodolfo and seamstress Mimi heads for tragedy and painter Marcello's affair with unfaithful singer Musetta provides comedy in the landmark Giacomo Puccini opera.",
2003-01-26,35,13035896.0,Ma Rainey's Black Bottom,Royale Theatre,120748.0,372588.0,51.03,81.25,2366,1074,0.4406,0,5,"Legendary blues musician ""Ma"" Rainey, an ambitious trumpeter who hopes she will perform his arrangement of her signature tune, and the rest of her band and hangers-on make their music and deal with the harsh reality of their business and lives in 1927 Chicago.",
2003-02-09,37,12134317.0,Take Me Out,Walter Kerr Theatre,127816.0,495036.0,45.75,80.0,2794,920,0.3796,0,8,"In this Tony Award®-winning Best Play, playwright Richard Greenberg celebrates the personal and professional intricacies of America’s favorite pastime. When Darren Lemming, the star center fielder for the Empires, comes out of the closet, the reception off the field reveals a barrage of long-held unspoken prejudices. Facing some hostile teammates and fraught friendships, Darren is forced to contend with the challenges of being a gay person of color within the confines of a classic American institution. As the Empires struggle to rally toward a championship season, the players and their fans begin to question tradition, their loyalties, and the price of victory. Directed by Scott Ellis.",
2003-02-16,38,14291821.0,Vincent in Brixton,John Golden Theatre,52471.0,187430.0,31.25,70.0,1679,796,0.5273,0,4,"The young artist Vincent van Gogh rents a room from, and falls in love with, an older widow in 1873 London.",
2003-02-23,39,13335615.0,As Long as We Both Shall Laugh,American Airlines Theatre,19830.0,,43.11,65.0,460,740,0.6216,0,1,Russian comedian Yakov Smirnoff examines the differences between men and women in this one-man show.,
2003-03-02,40,11437907.0,Urban Cowboy,Broadhurst Theatre,58766.0,290306.0,58.47,96.25,1005,1160,0.2888,0,3,"Texas drifter Bud meets and marries a local girl who's been unlucky in love, but the marriage is tested by infidelity and ego, in this musical version of the popular 1980 film.",
2003-03-09,41,5237855.0,The Play What I Wrote,Lyceum Theatre,6893.0,7754.0,2.09,4.0,3305,907,0.911,0,4,"Hamish McColl and Sean Foley recreate the comedy of the popular 1960s British team Morecambe and Wise, in an evening cowritten with Eddie Braben. A different celebrity ""mystery guest"" was featured for every night of the show's run.",
2003-03-16,42,12502067.0,A Day in the Death of Joe Egg,American Airlines Theatre,130302.0,232600.0,41.91,65.0,3109,740,0.8403,0,5,"A married couple struggle to deal with their disabled daughter, inventing conversations, characteristics and a full imaginary life for her as their own marriage falls apart.",
2003-03-16,42,12502067.0,Life x 3,Circle in the Square Theatre,269050.0,426160.0,54.11,80.0,4972,773,0.9189,0,7,"Two couples appear in three possible versions of the same dinner party, with each leading to a slightly different outcome.",
2003-03-23,43,12950709.0,Nine,Eugene O'Neill Theatre,356220.0,373100.0,90.85,101.0,3921,1049,0.9345,0,4,,
2003-04-06,45,12383712.0,A Year with Frog and Toad,Cort Theatre,88839.0,505074.0,42.96,91.25,2068,1052,0.2457,0,8,"The beloved characters created by children's book author Arnold Lobel go through a year of adventures, encountering whimsical creatures and deepening their own friendship.",
2003-04-06,45,12383712.0,The Look of Love,Brooks Atkinson Theatre,104336.0,,38.42,90.0,2716,1027,0.6611,0,4,"Burt Bacharach and Hal David's classic pop tunes from the 1960s and 1970s are spotlighted in this revue, plus ""Beginnings,"" a new song from the duo.",
2003-04-13,46,13258657.0,Enchanted April,Belasco Theatre,136009.0,536896.0,38.33,81.25,3548,1037,0.4277,0,8,"Four unhappy English women rent a villa in Tuscany for a month, discovering unexpected passions and renewing their appreciation of life.",
2003-04-13,46,13258657.0,Salome,Ethel Barrymore Theatre,176094.0,223419.0,62.62,85.0,2812,1086,0.8631,0,3,"King Herod lusts for his stepdaughter, Salome, who asks him to bring her the head of John the Baptist in exchange for her favors, in Oscar Wilde's take on the Biblical legend.",
2003-05-04,49,13978276.0,Bill Maher: Victory Begins at Home,Virginia Theatre,118401.0,570744.0,37.64,70.0,3146,1255,0.3133,0,8,"Former ""Politically Incorrect"" host Bill Maher addresses the War on Terror — Iraq, President George W. Bush and the ""Axis of Evil"" — in this one-man show.",
2003-05-11,50,13957866.0,"""Master Harold""...and the Boys",Royale Theatre,148824.0,544547.0,39.08,76.25,3808,1078,0.4416,0,8,In South Africa during the apartheid era a young white man's relationship with his two older black servants changes as he matures.,
2003-07-13,7,13268814.0,Avenue Q,John Golden Theatre,47049.0,161977.0,55.55,86.25,847,796,0.3547,0,3,"Humans and puppets interact in this tale of twenty-somethings learning how to live and love in New York City.  Think ""Sesame Street"" with adult themes, humor and song.",
2003-08-31,14,13800385.0,Little Shop of Horrors,Virginia Theatre,224313.0,287411.0,48.92,96.0,4585,1209,0.9481,0,4,"In this campy musical based on the 1960s cult horror film, nerdy Seymour, a florist's clerk, buys and nourishes a Venus fly trap-like plant, which he names for his beloved co-worker Audrey.  The plant ultimately grows big enough to devour everything in its path.",
2003-09-21,17,11815291.0,The Boy from Oz,Imperial Theatre,634326.0,836198.0,76.99,101.25,8239,1435,0.8202,0,7,"Australian entertainer Peter Allen becomes a star, marries and divorces Liza Minnelli, comes out of the closet, and ultimately succumbs to AIDS in this biographical musical featuring Allen's songs.",
2003-10-05,19,11933973.0,Golda's Balcony,Helen Hayes Theatre,103665.0,224702.0,63.06,76.25,1644,589,0.6978,0,4,William Gibson's one-woman play examines the life of Golda Meir and her journey from Milwaukee schoolteacher to Prime Minister of Israel.,
2003-10-05,19,11933973.0,The Retreat from Moscow,Booth Theatre,140023.0,225651.0,51.92,81.25,2697,789,0.8546,0,4,A history teacher and an editor of poetry discover that after 33 years their marriage is over.  Their adult son is caught in the middle.,
2003-10-12,20,14226788.0,Six Dance Lessons in Six Weeks,Belasco Theatre,121935.0,454714.0,34.17,80.0,3569,1029,0.4336,0,8,"A Florida widow hires a New York dance instructor for six weeks, and despite their differences,
the two discover they have more in common than they ever thought possible.",
2003-10-12,20,14226788.0,Wicked,Gershwin Theatre,662666.0,858516.0,63.0,100.0,10519,1773,0.9888,0,6,"Winner of three 2004 Tony Awards, Wicked is a Broadway phenomenon that looks at what happened in the Land of Oz… but from a different angle. With a thrilling score that includes the hits “Defying Gravity,” “Popular” and “For Good,” Wicked transfixes audiences with its wildly inventive story and opulent physical production.",
2003-10-19,21,14675789.0,The Violet Hour,Biltmore Theatre,140064.0,226053.0,51.1,81.0,2741,650,0.8434,0,5,A young publisher struggles to choose his next project while dealing with the appearance of a strange machine that spits out manuscript pages with information about his future.,
2003-10-26,22,14718839.0,Jackie Mason's Laughing Room Only,Brooks Atkinson Theatre,135331.0,390412.0,63.57,90.0,2129,1039,0.4098,0,5,Stand-up comic Jackie Mason offers an evening of song-and-dance in the vaudeville and variety traditions.,
2003-11-02,23,14230523.0,Henry IV,Vivian Beaumont Theater,211565.0,517890.0,43.97,85.0,4812,1047,0.766,0,6,,
2003-11-02,23,14230523.0,Never Gonna Dance,Broadhurst Theatre,311106.0,798446.0,58.87,101.25,5285,1174,0.5627,0,8,"Dancer John ""Lucky"" Garnett comes to New York to prove himself worthy of his fiancée's father by doing anything other than dancing. Instead, footwork and
romance with dance teacher Penny Carroll follow, in this musical inspired by the Fred Astaire-Ginger Rogers film Swing Time.",
2003-11-02,23,14230523.0,Oldest Living Confederate Widow Tells All,Longacre Theatre,46734.0,173256.0,34.88,50.0,1340,1094,0.3062,0,4,"Lucy Marsden, who married a 50-year-old Civil War veteran when she was 15 years old, narrates the 99-year history of her life in this one-woman play based on the Allan Gurganus novel.",
2003-11-02,23,14230523.0,Taboo,Plymouth Theatre,231432.0,570043.0,82.18,101.25,2816,1093,0.4294,0,6,"Pop star Boy George wrote the score for this autobiographical ode to the London club scene of
the 1980s. In the musical, Boy George becomes a star thanks to the success of the pop group
Culture Club and mentoring by performance artist Leigh Bowery.",
2003-11-09,24,16175586.0,Anna in the Tropics,Royale Theatre,204669.0,579530.0,42.16,81.25,4855,1078,0.563,0,8,"A new lector, or one who reads to the workers, at a family-owned cigar-making factory
in late 1920s South Florida, changes lives irrevocably in Nilo Cruz's Pulitzer Prize-winning
play.",
2003-11-09,24,16175586.0,Bobbi Boland,Cort Theatre,100389.0,520875.0,39.06,86.25,2570,1082,0.3393,0,7,,
2003-11-09,24,16175586.0,Wonderful Town,Al Hirschfeld Theatre,58118.0,237258.0,43.47,95.0,1337,1437,0.4652,0,2,"Ruth, an aspiring writer, and Eileen, her prettier, aspiring-actress younger sister, arrive in New York from Ohio in the 1930s and find frustration, career hopes and romance in the city of their dreams.",
2003-11-16,25,16067032.0,I Am My Own Wife,Lyceum Theatre,93243.0,336034.0,33.76,71.25,2762,704,0.4904,0,8,,
2004-02-01,36,11691291.0,Drowning Crow,Biltmore Theatre,110854.0,226053.0,45.28,80.0,2448,650,0.7532,0,5,"Playwright Regina Taylor updates Anton Chekhov's The Seagull to a world of television and
hip-hop. The play is set on the Gullah islands off the coast of South Carolina, where a black
family of artists gather to vacation for the summer as tensions and artistic hopes brew.",
2004-02-15,38,14755643.0,King Lear,Vivian Beaumont Theater,211700.0,363520.0,51.99,90.0,4072,1047,0.9723,0,4,,
2004-03-07,41,12955346.0,Twentieth Century,American Airlines Theatre,261145.0,349905.0,47.51,86.25,5497,740,0.9285,0,8,"A struggling Broadway producer tries to get a former lover, now a Hollywood star, to sign a contract to star in his latest (and as yet un-conceived) play as they travel on the luxury train Twentieth Century Limited from Chicago to New York.",
2004-03-14,42,14478420.0,Match,Plymouth Theatre,73635.0,150857.0,50.16,81.25,1468,1079,0.6803,0,2,,
2004-03-14,42,14478420.0,Sly Fox,Ethel Barrymore Theatre,181434.0,243173.0,68.47,91.25,2650,1058,0.8349,0,3,"An elderly man who has gotten rich off the gold rush in 1800s San Francisco schemes to bilk his greedy associates out of money by pretending to be an invalid, in Larry Gelbart's adaptation of Ben Jonson's satirical farce Volpone.",
2004-03-21,43,15509257.0,Barbara Cook's Broadway!,Vivian Beaumont Theater,86972.0,182430.0,33.68,60.0,2582,1047,0.822,0,3,"Barbara Cook takes audiences back to the Golden Age of Broadway — when she was its reigning
ingénue — in this evening of stories and songs by Rodgers and Hammerstein, Bock and Harnick,
Stephen Sondheim, and more.",
2004-03-28,44,15646629.0,Sixteen Wounded,Walter Kerr Theatre,92197.0,508536.0,38.18,80.0,2415,939,0.3215,0,8,"A Jewish baker in Amsterdam hires a young Palestinian man to be his assistant, and the two
develop an unlikely friendship.",
2004-04-04,45,15195053.0,A Raisin in the Sun,Royale Theatre,324919.0,612848.0,58.3,81.25,5573,1078,0.6462,0,8,"Lorraine Hansberry's landmark drama was one of the first on Broadway to examine African-American life on the cusp of the civil rights era.  Walter Younger and his mother, Lena, both yearn to move their family out of Chicago's Southside ghetto.  When Lena's late husband's insurance check arrives, Lena hopes to use it to buy a house in a white neighborhood — while Walter hopes to invest it in a liquor business.",
2004-04-04,45,15195053.0,Assassins,Studio 54,281856.0,374929.0,51.44,91.25,5479,887,0.8824,0,7,"The inmates of France's Charenton Asylum are instructed to perform a play detailing the events that led to the assassination of radical journalist Jean-Paul Marat during the French Revolution. The performance is directed by their fellow inmate, the Marquis de Sade, and has a revolutionary character of its own, intended to defy the hospital director and staff.",
2004-04-04,45,15195053.0,Bombay Dreams,Broadway Theatre,562995.0,1043430.0,62.18,101.25,9054,1761,0.7345,0,7,"This Bollywood-style musical follows a romance between a poor man from the slums of India
and the wealthy girl he loves.",
2004-04-11,46,17577340.0,Jumpers,Brooks Atkinson Theatre,269048.0,592944.0,42.72,95.0,6298,969,0.8124,0,8,"An aging professor of moral philosophy attempts to create a lecture while ignoring a nearby
corpse, his wife entertaining his university boss nearby, and a chorus of academic gymnasts
called Jumpers. Politics, space travel and religion also appear in Tom Stoppard's fantastical
comedy.",
2004-04-18,47,17072164.0,"Caroline, or Change",Eugene O'Neill Theatre,341067.0,762120.0,56.6,100.0,6026,1065,0.7073,0,8,"Roundabout Theatre Company (Todd Haimes, Artistic Director/CEO) presents a new Broadway production of Tony Kushner & Jeanine Tesori’s Tony Award–nominated and Olivier Award–winning musical Caroline, or Change. Sharon D Clarke stars in an exhilarating, Olivier Award–winning performance as Caroline, an African-American maid whose world of 1963 Louisiana ripples with change both large and small. Erupting with transcendent songs and larger-than-life imagination, Caroline, or Change explores how, in times of great transformation, even the simplest acts shake the earth.",
2004-04-18,47,17072164.0,Prymate,Longacre Theatre,9851.0,260214.0,32.51,76.25,303,1095,0.0692,0,4,"A group of researchers teach an ape to ""speak"" through sign language then battle over his life as he ages.",
2004-05-02,49,14535865.0,Frozen,Circle in the Square Theatre,52934.0,331500.0,38.14,85.0,1388,650,0.3559,0,6,"Disney's 2013 Oscar-winning film comes to Broadway, a full-length stage work told in two acts—the first and only incarnation of the tale that expands upon and deepens its indelible plot and themes through new songs and story material from the film’s creators, including Kristen Anderson-Lopez (Up Here, Winnie the Pooh, In Transit), EGOT-winner Robert Lopez (Avenue Q, The Book of Mormon, Up Here), and Jennifer Lee (Zootopia, Wreck-It Ralph). In fact, this new stage production features more than twice as much music as the film.",
2004-05-09,50,15153456.0,Sight Unseen,Biltmore Theatre,119032.0,226053.0,46.94,80.0,2536,650,0.7803,0,5,"Celebrated painter Jonathan Waxman reconnects with his former lover Patricia, only to do battle
with her over a painting he'd made of her when they were a couple.",
2004-05-23,52,16533782.0,Marc Salem's Mind Games on Broadway,Lyceum Theatre,1037.0,35738.0,43.2,56.25,24,712,0.0337,0,1,,
2004-06-27,4,16739083.0,After the Fall,American Airlines Theatre,158242.0,226300.0,50.54,86.25,3131,740,0.8462,0,5,"A man examines his life and failed marriage to determine whether he should marry again. Arthur Miller's non-linear, autobiographical play is said to be partly based on his marriage to Marilyn Monroe.",
2004-06-27,4,16739083.0,The Frogs,Vivian Beaumont Theater,312750.0,538560.0,51.52,90.0,6071,1047,0.9664,0,6,,
2004-08-01,9,15168615.0,"Dracula, the Musical",Belasco Theatre,133879.0,146515.0,50.79,61.25,2636,1029,0.8539,0,3,"Frank Wildhorn, Christopher Hampton and Don Black musicalize the Bram Stoker novel about a mysterious Transylvanian count in Victorian London who seduces young women for their blood.",
2004-09-26,17,10663786.0,Brooklyn,Gerald Schoenfeld Theatre,135106.0,352319.0,53.15,95.0,2542,1044,0.6087,0,4,,
2004-09-26,17,10663786.0,Reckless,Biltmore Theatre,149256.0,233909.0,49.8,78.0,2997,650,0.9222,0,5,"A housewife discovers her husband has hired a hitman to kill her, sending her out the window
and on an unusual series of misadventures in Craig Lucas's dark comedy, which premiered Off-Off-Broadway in 1983.",
2004-10-03,18,11250841.0,Twelve Angry Men,American Airlines Theatre,143510.0,219875.0,49.78,86.25,2883,740,0.7792,0,5,"Eleven jurors are convinced of an accused murderer's guilt, but one holdout convinces them to
look at their consciences — and prejudices — again.",
2004-10-17,20,12179708.0,Laugh Whore,Cort Theatre,104524.0,472581.0,39.73,81.25,2631,1062,0.3539,0,7,"Mario Cantone sings, tells stories of his Italian-American childhood and sends up every diva
from Liza Minnelli to Barbara Walters, in this one-man show directed by Joe Mantello.",
2004-10-24,21,12484083.0,"'night, Mother",Royale Theatre,125452.0,322158.0,53.57,86.25,2342,1078,0.5431,0,4,"In Marsha Norman's Pulitzer Prize-winning play, a daughter announces to her mother that she will kill herself at the end of the evening, leading to an uneasy completion of routine tasks and a series of hopelessly ineffectual pleadings and confrontations.",
2004-10-24,21,12484083.0,The Good Body,Booth Theatre,40369.0,166416.0,44.46,81.25,908,794,0.3812,0,3,"Playwright Eve Ensler (The Vagina Monologues) stars in her own one-woman show, based on
interviews with women around the world on how they manipulate their bodies to look
beautiful.",
2004-11-07,23,11861307.0,Dame Edna: Back with a Vengeance,Music Box Theatre,184729.0,303824.0,67.0,86.25,2757,999,0.6899,0,4,"Self-proclaimed ""gigastar"" Dame Edna Everage, the drag persona of Australian actor Barry Humphries, returns to Broadway to sing, tell stories of her life and rise to fame, insult her audiences, and, of course, toss them gladioli to take home as souvenirs.",
2004-11-07,23,11861307.0,Democracy,Brooks Atkinson Theatre,273582.0,,57.43,95.0,4764,1035,0.7671,0,6,,
2004-11-07,23,11861307.0,Whoopi,Lyceum Theatre,103879.0,222060.0,46.17,76.25,2250,922,0.6101,0,4,"Whoopi Goldberg presents an evening of comic monologues spoken by various characters, from a nine-year-old girl to an elderly man, from a ""dope fiend"" to a valley girl.",
2004-11-14,24,14360883.0,700 Sundays,Broadhurst Theatre,492475.0,424053.0,105.18,101.25,4682,1186,0.9869,0,4,"Billy Crystal takes a look back at his Long Island childhood, paying special tribute to his hard-working father, who loved jazz and baseball.",
2004-11-14,24,14360883.0,Pacific Overtures,Studio 54,217160.0,285750.0,54.76,91.25,3966,929,0.8538,0,5,Stephen Sondheim and John Weidman's musical examines Japan's forced opening to the West in 1853 after 200 years of isolation from the Western world.  The staging incorporates techniques used in the traditional Noh and Kabuki theatrical styles.,
2004-11-28,26,17365001.0,Gem of the Ocean,Walter Kerr Theatre,194516.0,472469.0,47.29,85.0,4113,939,0.6257,0,7,"The penultimate entry in August Wilson's 10-play cycle on African-American life in Pittsburgh is set in 1904. Aunt Ester, a 285-year-old former slave, takes wandering
fugitive Citizen Barlow into her home and guides him on a mystical journey toward healing his guilt over the crime he has committed.",
2004-11-28,26,17365001.0,The Rivals,Vivian Beaumont Theater,98762.0,320040.0,40.69,80.0,2427,1058,0.5735,0,4,,
2004-12-12,28,16751477.0,Little Women,Virginia Theatre,550889.0,843952.0,66.67,99.0,8263,1222,0.8452,0,8,"Jo March and her sisters Meg, Beth and Amy grow up, find themselves and find love during and
after the Civil War, in this musical based on the classic Louisa May Alcott novel.",
2004-12-26,30,15929896.0,Good Vibrations,Eugene O'Neill Theatre,255720.0,589715.0,65.55,90.0,3901,1077,0.5174,0,7,"The music of the Beach Boys forms the backdrop for the story of several high school kids who
long to escape their New England town and drive to California, ultimately trying to bring along
the class valedictorian because she has a car — and a crush on one of the guys.",
2005-01-16,33,14122787.0,Brooklyn Boy,Biltmore Theatre,119248.0,233909.0,44.6,78.0,2674,650,0.8228,0,5,"A novelist finally finds success with an autobiographical novel, but just as his career takes off, his marriage, his friendships and his father's health take sharp turns for the worse.",
2005-02-06,36,11096337.0,Dirty Rotten Scoundrels,Imperial Theatre,525491.0,946981.0,63.16,101.25,8320,1435,0.7247,0,8,Composer-lyricist David Yazbek and librettist Jeffrey Lane adapt the 1988 film about two conmen — one elegant and one slovenly — who scheme to bilk rich women out of their money on the French Riviera.,
2005-02-20,38,14239742.0,All Shook Up,Palace Theatre,95406.0,126934.0,56.39,100.0,1692,1704,0.993,0,1,"The songs of Elvis Presley form the backdrop for this musical about a mysterious, leather-jacketed stranger who shakes up a small Midwestern town in the 1950s. Librettist Joe DiPietro's tale of the cross-dressing, mistaken identity and romance that ensue was inspired by Twelfth Night and other Shakespearean comedies.",
2005-02-20,38,14239742.0,Spamalot,Sam S. Shubert Theatre,719425.0,794749.0,74.96,101.25,9597,1463,0.9371,0,7,"Monty Python stalwart Eric Idle and composer John Du Prez adapt the classic film Monty
Python and the Holy Grail into a musical featuring the Knights Who Say Ni, killer rabbits, accused witches and other Python
touches. Spamalot adds swipes at Vegas glitz and Broadway conventions to the film's anarchic
spirit.",
2005-03-13,41,14731195.0,Doubt,Walter Kerr Theatre,241812.0,414299.0,56.25,89.0,4299,924,0.7754,0,6,"The musical, based on Twentieth Century Fox Motion Picture, features a book by Karey Kirkpatrick and John O’Farrell and music and lyrics by Wayne Kirkpatrick andKarey Kirkpatrick, the Tony Award nominated team behind Something Rotten! Four-time Tony Award winner Jerry Zaks(Hello, Dolly!) will direct and Lorin Latarro (Waitress) will choreograph.",
2005-03-13,41,14731195.0,Jackie Mason: Freshly Squeezed,Helen Hayes Theatre,143286.0,281280.0,62.38,81.25,2297,586,0.6533,0,6,,
2005-03-13,41,14731195.0,Julius Caesar,Belasco Theatre,545149.0,639723.0,80.98,101.25,6732,997,0.844,0,8,"In William Shakespeare's tragedy of political ambition, corruption and betrayal, Roman senators Brutus and Cassius lead a group effort to assassinate the powerful Julius Caesar, then battle with Mark Antony over control of the state.",
