week_ending,week_number,weekly_gross_overall,show,theatre,weekly_gross,potential_gross,avg_ticket_price,top_ticket_price,seats_sold,seats_in_theatre,pct_capacity,performances,previews,synopsis,start_date
1993-11-07,23,6678591.0,Gray's Anatomy,Vivian Beaumont Theater,15847.0,,15.19,,1043,1087,0.9595,0,1,,
1993-11-07,23,6678591.0,Laughter on the 23rd Floor,Richard Rodgers Theatre,204540.0,,20.07,,10192,1382,0.9219,0,8,"Neil Simon's play is based on his days writing for a live comedy show in the 1950s, with a temperamental star modeled after Sid Caesar.",
1993-11-07,23,6678591.0,The Kentucky Cycle,Royale Theatre,99788.0,,21.84,,4568,1044,0.5469,0,8,"Robert Schenkkan's Pulitzer Prize-winning tells the story of three families who live in eastern Kentucky from the Revolutionary War era until the 1970s, and the familial, racial and political conflicts that ultimately tear them and their land apart.",
1993-11-07,23,6678591.0,The Red Shoes,Gershwin Theatre,356071.0,,28.32,,12571,1924,0.8167,0,8,"A girl who longs to be a ballerina is torn between an imperious ballet impresario and the young composer she loves, in this musical adaptation of the Michael Powell film based on the Hans Christian Andersen fairy tale.",
1993-11-28,26,8285302.0,My Fair Lady,Virginia Theatre,349157.0,,56.22,,6211,1233,1.0075,0,5,"For the first time in 25 years, Lerner & Loewe’s My Fair Lady returns to Broadway at Lincoln Center Theater, directed by Tony winner Bartlett Sher. Boasting such classic songs as “I Could Have Danced All Night,” “The Rain in Spain,” “Wouldn’t It Be Loverly” and “On the Street Where You Live,” My Fair Lady tells the story of Eliza Doolittle, a young Cockney flower seller, and Henry Higgins, a linguistics professor who is determined to transform her into his idea of a “proper lady.” But who is really being transformed? Laura Benanti, Harry Hadden-Paton, Danny Burstein and Rosemary Harris lead a stellar cast directed by Tony winner Bartlett Sher.",
1993-12-26,30,6760936.0,The Government Inspector,Lyceum Theatre,22527.0,,22.5,,1001,855,0.2342,0,5,"A well-dressed wanderer comes upon a small Russian town, where he is mistaken for a government inspector. He is able to swindle the town residents and politicians who want him to keep their own corruption quiet, in Nikolai Gogol's 1836 play.",
1994-01-09,32,6291796.0,No Man's Land,Criterion Center Stage Right,41120.0,,31.37,,1311,499,0.8758,0,3,,
1994-02-20,38,6059565.0,Carousel,Vivian Beaumont Theater,124453.0,,40.19,,3097,1070,0.9648,0,3,"Brash carousel barker Billy Bigelow and Julie Jordan, a quiet girl who works in the mill, fall in love, marry, and have a stormy relationship that leads to tragedy and an attempt at mending old wounds from beyond the grave, in Rodgers and Hammerstein's musical adaptation of Ferenc Molnar's play, Liliom.",
1994-02-20,38,6059565.0,Damn Yankees,Marquis Theatre,284550.0,,25.66,,11089,1596,0.8685,0,8,"A middle-aged man sells his soul to the devil to become a crackerjack baseball player who can help his beloved Washington Senators beat the Yankees in the World Series. But despite the devil's best attempts — including the sexy Lola — to keep him under his sway, the man wants to return to his wife.",
1994-03-13,41,6013188.0,Beauty and the Beast,Lunt-Fontanne Theatre,410334.0,,45.5,,9018,1740,0.8638,0,6,,
1994-03-13,41,6013188.0,The Flowering Peach,Lyceum Theatre,46020.0,,19.9,,2312,870,0.3796,0,7,Clifford Odets comically reimagines the Biblical Noah and his family debating the coming Great Flood — and then struggling to survive it on the ark they have built.,
1994-03-20,42,6556911.0,A Little More Magic,Belasco Theatre,42000.0,127793.0,21.01,40.0,1999,1010,0.3299,3,3,"The Canadian black magic troupe Famous People Players manipulate puppet versions of well-known figures, using ultraviolet light to create effects in which the puppets become invisible but the objects they are holding continue to be seen.",
1994-03-27,43,6585696.0,Jackie Mason: Politically Incorrect,John Golden Theatre,67333.0,,37.16,,1812,805,0.3752,0,6,The controversial comedian Jackie Mason attacks perceptions of cultural stereotypes and addresses instances in which he has taken heat publicly for addressing those stereotypes.,
1994-03-27,43,6585696.0,Passion,Plymouth Theatre,117096.0,,34.59,,3385,1043,0.8114,0,4,,
1994-04-03,44,8310836.0,Medea,Longacre Theatre,128295.0,,28.28,,4537,1095,0.5919,0,7,"Eugenie Leontovich freely adapts the Robinson Jeffers version of Medea, the Euripedes tragedy about a vengeful sorceress who is scorned by the handsome young warrior she loves and has helped succeed.",
1994-04-03,44,8310836.0,Picnic,Criterion Center Stage Right,73853.0,,23.08,,3200,499,0.9161,0,7,"A sexy drifter shakes up a Kansas town, particularly its female inhabitants, including a beautiful young girl who yearns for a more exciting life, her plain and bookish sister, and a moralistic but sexually frustrated schoolteacher.",
1994-04-10,45,7537525.0,"Twilight: Los Angeles, 1992",Cort Theatre,22597.0,,24.3,,930,1104,0.8424,0,1,"Anna Deavere Smith examines the aftermath of the Rodney King riots in Los Angeles, in a one-woman show in which she impersonates many of the people she interviewed about the event.",
1994-04-17,46,7334268.0,An Inspector Calls,Royale Theatre,96821.0,,32.89,,2944,1035,0.7111,0,4,"An inspector visits an engagement party in a middle-class home in the English countryside to question the guests about the recent suicide of a young woman, in J.B. Priestly's thriller.",
1994-04-17,46,7334268.0,Broken Glass,Booth Theatre,101439.0,277455.0,21.61,,4693,806,0.7278,0,8,"A Jewish couple considers their lives and their pasts in 1938 Brooklyn, as storm clouds gather in Nazi Germany.",
1994-04-17,46,7334268.0,Sally Marr...and Her Escorts,Helen Hayes Theatre,59313.0,,27.59,,2150,588,0.5224,0,7,"Sally Marr, the comedienne who was the mother of Lenny Bruce, gives a course in standup comedy that leads to recollections of the pain in her own life that fostered her standup persona.",
1994-04-17,46,7334268.0,The Best Little Whorehouse Goes Public,Lunt-Fontanne Theatre,55345.0,,10.38,,5331,1514,0.8803,0,4,"In this sequel to The Best Little Whorehouse in Texas, Miss Mona is asked by the IRS to run the Stallion Fields brothel in Las Vegas, but must contend with right-wing politician A. Harry Hardast's efforts to close it.",
1994-04-17,46,7334268.0,The Rise and Fall of Little Voice,Neil Simon Theatre,24807.0,,18.79,,1320,1386,0.2381,0,4,"A shy, working-class English girl with the extraordinary ability to mimic the pop singers from her dead father's record collection may be a meal ticket for a low-rent agent, even as the girl's abusive mother hopes to land the agent as a husband.",
1994-04-24,47,8275038.0,Grease,Eugene O'Neill Theatre,163151.0,,54.99,,2967,1090,0.9073,0,3,,
1994-06-12,2,7638330.0,Hedda Gabler,Criterion Center Stage Right,78266.0,,29.11,,2689,499,0.8981,0,6,"Ibsen's Hedda Gabler presents a psychological study of a cultivated woman, recently returned from her honeymoon, whose boredom and dissatisfaction in a stifling environment lead her to destroy others — and herself.",
1994-06-26,4,8095845.0,Ian McKellen: A Knight Out at the Lyceum,Lyceum Theatre,192571.0,,50.76,,3794,870,0.8722,5,0,Sir Ian McKellen recalls his personal journey as a gay man and actor in this autobiographical one-man show.,
1994-08-21,12,7189335.0,"Philadelphia, Here I Come!",Criterion Center Stage Right,80679.0,,29.17,,2766,499,0.9238,0,6,"Gareth O'Donnell leaves his life in Ireland behind for fame and fortune in America, expressing his feelings through his two sides — the shy and dutiful public side and the angry, defiant private side — in Brian Friel's comedy.",
1994-09-25,17,6906431.0,Show Boat,Gershwin Theatre,462220.0,,53.87,,8580,1918,0.8947,0,5,"Jerome Kern and Oscar Hammerstein II's groundbreaking musical version of Edna Ferber's novel examines the lives of Cap'n Andy and his troupe of traveling show boat performers, including his naïve daughter Magnolia, her gambling husband Gaylord Ravenal, the tragic mixed-race actress Julie, and black stevedore Joe, who marvels at the constancy of the ""Ol' Man River"" they travel on.",
1994-10-30,22,7062874.0,The Glass Menagerie,Criterion Center Stage Right,49383.0,,34.95,,1413,499,0.9439,0,3,"Two-time Academy Award-winner Sally Field and two-time Tony Award-winner Joe Mantello return to the Broadway stage to star in Tennessee Williams’s most cherished play, The Glass Menagerie. Tony Award winner Sam Gold (Fun Home) will direct the production, a transfer from a Dutch production at Toneelgroep Amsterdam that garnered rave reviews and massive international attention.",
1994-11-06,23,7718102.0,Sunset Boulevard,Minskoff Theatre,717236.0,,60.41,,11872,1710,0.9918,0,7,"In her mansion on Sunset Boulevard, faded, silent-screen goddess, Norma Desmond, lives in a fantasy world. Impoverished screen writer, Joe Gillis, on the run from debt collectors, stumbles into her reclusive world. Persuaded to work on Norma’s ‘masterpiece’, a film script that she believes will put her back in front of the cameras, he is seduced by her and her luxurious life-style. Joe becomes entrapped in a claustrophobic world until his love for another woman leads him to try and break free with dramatic consequences.",
1994-11-06,23,7718102.0,The Shadow Box,Circle in the Square Theatre,45338.0,,20.44,,2218,724,0.7659,0,4,"Three terminally ill patients and their family members prepare to face the inevitable in the same hospital, in Michael Cristofer's Pulitzer Prize and Tony Award-winning play.",
1994-11-20,25,7837219.0,Basia on Broadway,Neil Simon Theatre,0.0,,0.0,,0,1788,0.0,0,0,Polish pop-jazz singer Basia performs a concert of her material on Broadway.,
1994-11-20,25,7837219.0,"The Flying Karamazov Brothers ""Do the Impossible""",Helen Hayes Theatre,72498.0,,24.38,,2974,597,0.6227,1,7,"The popular juggling performers juggle objects of all kinds, many of which are brought onstage from volunteers in the audience.",
1994-11-20,25,7837219.0,What's Wrong with This Picture?,Brooks Atkinson Theatre,109627.0,,16.06,,6828,1067,0.7999,0,8,"A dead housewife comes back to haunt her family, in Donald Margulies' dark comedy.",
1994-12-11,28,9017015.0,A Tuna Christmas,Booth Theatre,48413.0,,29.31,,1652,787,0.5248,0,4,"Two actors play all of the crazy citizens of Tuna, Texas, as they prepare for the town's annual Christmas festivities.",
1994-12-18,29,8289863.0,Comedy Tonight,Lunt-Fontanne Theatre,69008.0,,10.04,,6870,737,1.5536,1,5,"This vaudeville-style evening features four comics — Mort Sahl, Dorothy Loudon, Joy Behar and Michael Davis.",
1995-01-15,33,7331976.0,The Marriage of Kitty,Comedy Theatre,90410.0,,28.67,,3153,499,0.9027,0,7,,
1995-01-22,34,6519901.0,Love! Valour! Compassion!,Walter Kerr Theatre,122557.0,,33.72,,3635,936,0.9709,0,4,"Eight gay men confront their lives, loves and friendships over three successive weekends at a farmhouse in Duchess County, New York.",
1995-02-05,36,5843103.0,Uncle Vanya,Circle in the Square Theatre,31152.0,130320.0,20.23,,1540,723,0.5325,0,4,,
1995-02-12,37,6190979.0,Smokey Joe's Cafe,Virginia Theatre,101075.0,,17.51,,5774,1212,0.794,0,6,"This revue of the beloved rock 'n' roll songs written by Jerry Leiber and Mike Stoller features ""Love Potion #9,"" ""On Broadway,"" ""I'm a Woman,"" ""Yakety Yak,"" and more.",
1995-02-12,37,6190979.0,The Heiress,Cort Theatre,46569.0,,14.87,,3131,1095,0.5719,0,5,,
1995-03-05,40,7077393.0,Arcadia,Vivian Beaumont Theater,91599.0,,22.76,,4025,1072,0.9387,0,4,,
1995-03-05,40,7077393.0,Rob Becker's Defending the Caveman,Booth Theatre,30998.0,,31.09,,997,597,0.2386,0,7,Comedian Rob Becker explores the differences between men and women in this evening of standup.,
1995-03-12,41,7499790.0,How to Succeed in Business Without Really Trying,Richard Rodgers Theatre,166513.0,,34.14,,4877,1365,0.8932,0,4,"Window-washer J. Pierrepont Finch schemes his way to the top of the World Wide Wicket Corporation in Frank Loesser, Abe Burrows, Jack Weinstock and Willie Gilbert's musical satire of big business.",
1995-03-12,41,7499790.0,Translations,Plymouth Theatre,202203.0,,31.18,,6486,1079,0.7514,0,8,,
1995-03-19,42,8197186.0,Having Our Say,Booth Theatre,49791.0,142446.0,23.65,,2105,781,0.5391,0,5,"African-American sisters Sadie and Bessie Delaney, both over 100 years old, tell their stories, including growing up as the daughters of a former slave turned respected professor, maintaining professional careers and integrating a New York suburb, in this adaptation of the real-life sisters' book of the same name.",
1995-04-02,44,7995184.0,Gentlemen Prefer Blondes,Lyceum Theatre,107358.0,,27.86,,3853,899,0.5357,0,8,Gold-digging showgirl Lorelei Lee and her friend Dorothy set out to snare wealthy husbands on a luxury cruise in this musical version of the Anita Loos novel.,
1995-04-09,45,8319168.0,A Month in the Country,Criterion Center Stage Right,133766.0,,34.16,,3916,499,0.981,0,8,Natalya discovers that she is passionately in love with her son's tutor while spending a month on a country estate in Ivan Turgenev's 1872 play.,
1995-04-09,45,8319168.0,Indiscretions,Ethel Barrymore Theatre,211170.0,,34.52,,6117,1085,0.7047,0,8,"In Jeremy Sams' translation of Jean Cocteau's Les Enfants Terribles, Michael announces he has fallen in love to his dysfunctional family, who scheme to stop his affair.",
1995-04-23,47,10410923.0,My Thing of Love,Martin Beck Theatre,45863.0,,16.25,,2822,1300,0.5427,0,4,"A suburban marriage is threatened when the wife finds out about her husband's affair, in Alexandra Gersten's dark comedy.",
1995-04-23,47,10410923.0,On the Waterfront,Brooks Atkinson Theatre,132652.0,,19.09,,6950,1082,0.8029,0,8,"In this stage adaptation of the 1954 film, dock worker Terry Molloy finds the courage to inform on Johnny Friendly, the mob boss who terrorizes the docks with threatening crimes.",
1995-04-23,47,10410923.0,The Rose Tattoo,Circle in the Square Theatre,22162.0,,19.29,,1149,724,0.529,0,3,A Sicilian seamstress mourning her husband's death finds love again with a passionate truck driver.,
1995-05-21,51,9432531.0,Chronicle of a Death Foretold,Plymouth Theatre,37540.0,,16.61,,2260,1024,0.5518,0,4,"In this musical adaptation of the Gabriel Garcia Marquez novel, a bridegroom rejects his bride when he discovers she is not a virgin, forcing her brothers to seek revenge on her former lover to preserve the family honor.",
1995-06-11,2,9014415.0,Buttons on Broadway,Ambassador Theatre,27020.0,289283.0,16.05,50.0,1684,1120,0.2506,3,3,Veteran comedian and Academy Award-winning actor Red Buttons performs an evening of standup and song sprinkled with anecdotes about his life and friends.,
1995-06-18,3,9077149.0,The Play's the Thing,Criterion Center Stage Right,32682.0,,26.36,50.0,1240,499,0.8283,0,3,"In Ferenc Molnar's farce, a young playwright is distraught when he overhears the actress he loves having an affair with another man. His mentor must convince him that she is only rehearsing a play — and that he must write her a better one.",
1995-09-03,14,6906418.0,Company,Criterion Center Stage Right,173012.0,235778.0,49.53,67.5,3493,499,1.0,0,7,The Ukrainian dance company founded by Pavel Virsky performs an evening of the folk dances of their country.,
1995-09-17,16,6974942.0,Moon Over Buffalo,Martin Beck Theatre,203836.0,495397.0,24.34,60.0,8376,1294,0.9247,0,7,"George and Charlotte Hay, a husband-and-wife team of actors, struggle to perform Cyrano de Bergerac and Private Lives in repertory while dealing with family crises and the possibility of a Hollywood director's visit.",
1995-10-08,19,8022467.0,Patti LuPone on Broadway,Walter Kerr Theatre,83374.0,179924.0,44.54,60.0,1872,905,0.5171,0,4,"Patti LuPone performs a concert of pop songs and standards, ranging from Kurt Weill to James Taylor, and highlights from her Tony Award-winning Broadway career, with the Mermen quartet of backup singers.",
1995-10-08,19,8022467.0,Swinging on a Star,Music Box Theatre,61493.0,,24.44,65.0,2516,991,0.6347,0,4,Hollywood songwriter Johnny Burke's songs illustrate different aspects of American life from the 1930s through the 1950s.,
1995-10-08,19,8022467.0,Victor / Victoria,Marquis Theatre,792398.0,,61.45,75.0,12895,1601,1.0068,0,8,"A down-on-her-luck singer is convinced by a gay impresario to masquerade as a female impersonator, becoming a huge success in Paris nightclubs and attracting the attentions of a Chicago gangster, in the musical version of the 1982 film.",
1995-10-15,20,9236134.0,"Hello, Dolly!",Lunt-Fontanne Theatre,323839.0,610768.0,35.79,67.5,9049,1429,0.9046,0,7,"A meddlesome matchmaker brings together the young clerk of a wealthy Yonkers merchant and his assistant with a widowed milliner and her assistant, while making sure she herself gets to marry the merchant, in Jerry Herman and Michael Stewart's musical adaptation of Thornton Wilder's The Matchmaker.",
1995-10-15,20,9236134.0,The Tempest,Broadhurst Theatre,321603.0,437609.0,49.1,65.0,6550,1145,0.8172,0,7,,
1995-10-29,22,9326705.0,Master Class,John Golden Theatre,117959.0,,30.92,45.0,3815,793,0.9622,0,5,"Terrence McNally's Tony Award-winning play is based on the legendary series of master classes given by opera diva Maria Callas at Juilliard. In the play, Callas berates her students as much as she encourages them and confronts the disappointments in her own life and her relationship with the shipping tycoon Aristotle Onassis.",
1995-10-29,22,9326705.0,Sacrilege,Belasco Theatre,50389.0,187996.0,21.4,45.0,2355,1018,0.4627,0,5,"Sister Grace, an outspoken nun who serves as a drug counselor in SoHo and is known for discussing the church's controversial stance on many issues, gets in hot water with the Pope when she suggests that women should be allowed to join the priesthood.",
1995-11-05,23,9518059.0,Danny Gans on Broadway: The Man of Many Voices,Neil Simon Theatre,34350.0,,9.28,40.0,3700,1346,0.3436,0,8,"Acclaimed impressionist Danny Gans brings his impersonations of Frank Sinatra, Sarah Vaughan, George Burns and more to Broadway.",
1995-11-12,24,9476147.0,Racing Demon,Vivian Beaumont Theater,113592.0,,19.59,45.0,5798,1056,0.6863,0,8,"An older, spiritually doubting member of the Church of England's clergy competes with a brash young evangelical for the souls of the people in a working-class neighborhood in South London.",
1995-11-19,25,9357234.0,Holiday,Circle in the Square Theatre,21750.0,72400.0,22.47,50.0,968,724,0.6685,0,2,,
1995-11-19,25,9357234.0,The School for Scandal,Lyceum Theatre,27661.0,239862.0,24.7,50.0,1120,924,0.1515,1,7,,
1995-12-17,29,9169616.0,The Father,Criterion Center Stage Right,60784.0,,28.56,55.0,2128,499,0.8529,0,5,,
1996-02-04,36,5244009.0,Bus Stop,Circle in the Square Theatre,19782.0,287600.0,23.83,50.0,830,721,0.5756,0,2,"A bus gets snowed in at a Kansas diner, forcing disillusioned saloon singer Cherie to deal a little longer with Bo Decker, the boisterous but naïve cowboy who insists on marrying her, as the other passengers make connections and confront the disappointments in their own lives.",
1996-02-25,39,7189552.0,Getting Away with Murder,Broadhurst Theatre,226155.0,,31.53,55.0,7173,1156,1.0342,0,6,"This non-musical theatre piece by Stephen Sondheim, co-written with George Furth, is a thriller that puts seven patients of a psychiatrist together for a session on the top floor of an apartment building, with the doctor permanently unavailable.",
1996-03-03,40,6118361.0,Inherit the Wind,Royale Theatre,221249.0,,39.08,60.0,5661,1054,0.7673,0,7,"This courtroom drama is based on the 1925 Scopes ""Monkey Trial,"" in which a Tennessee teacher was charged with teaching that man evolved from apes, instead of state-mandated Creationism. The drama contains a powerful confrontation between a character based on William Jennings Bryan, who believes only what he reads in the Bible, and another based on Clarence Darrow, who defends science and open intellectual inquiry.",
1996-03-17,42,6816345.0,Seven Guitars,Walter Kerr Theatre,22224.0,,31.75,60.0,700,947,0.7392,0,1,"In Pittsburgh's Hill District in 1948, an aspiring blues musician returns home for the woman he loves, an ailing old man hopes for an heir to carry on his name, and three women cope with betrayal and disappointment.",
1996-03-24,43,8514358.0,A Funny Thing Happened on the Way to the Forum,St. James Theatre,456395.0,712721.0,49.39,70.0,9241,1617,0.7144,0,8,"Ancient Roman slave Pseudolus schemes to win his freedom by helping his young master Hero win the beautiful courtesan Philia, who is betrothed to the egotistical soldier Miles Gloriosus, in this musical farce based on the plays of Plautus.",
1996-03-24,43,8514358.0,A Midsummer Night's Dream,Lunt-Fontanne Theatre,252870.0,593349.0,38.03,65.0,6649,1448,0.7653,0,6,,
1996-03-24,43,8514358.0,Love Thy Neighbor,Booth Theatre,63638.0,,31.72,49.5,2006,781,0.4281,1,5,"Jackie Mason skewers Jewish-Gentile relations, celebrities, and Internet addicts in this one-man comedy show.",
1996-03-24,43,8514358.0,State Fair,Music Box Theatre,117048.0,,32.66,75.0,3584,989,0.604,0,6,"The Frake family journeys to the annual state fair in Iowa, where the parents enter hog contests and mincemeat and jelly competitions and the children find romance with big-city types, in this stage adaptation of Rodgers and Hammerstein's 1945 film musical.",
1996-03-31,44,8724309.0,A Delicate Balance,Plymouth Theatre,70917.0,338832.0,19.94,45.0,3556,1079,0.8239,0,4,"Suburban couple Agnes and Tobias, who live with Agnes's alcoholic sister Claire, must cope with the unexpected arrivals of their friends Harry and Edna and their daughter Julia, in Edward Albee's Pulitzer Prize-winning play.",
1996-03-31,44,8724309.0,The Apple Doesn't Fall...,Lyceum Theatre,23213.0,,18.59,45.0,1249,924,0.3379,0,4,A woman reestablishes a relationship with her Alzheimer's-afflicted mother in Trish Vradenburg's comedy-drama.,
1996-04-14,46,10418413.0,Big,Sam S. Shubert Theatre,358670.0,,41.89,70.0,8562,1449,0.8441,0,7,,
1996-04-14,46,10418413.0,"Bring in 'da Noise, Bring in 'da Funk",Ambassador Theatre,232109.0,,38.93,67.5,5962,1064,0.8005,0,7,"Songs and dance, particularly innovative tap stylings led by choreographer Savion Glover, highlight the history of black men in America from slavery to the present day.",
1996-04-21,47,10130202.0,Buried Child,Brooks Atkinson Theatre,101397.0,,21.46,45.0,4725,1021,0.7713,0,6,"In Sam Shepard's Pulitzer Prize-winning play, Vince returns to his childhood farm with his girlfriend, only to find emotionally and physically crippled family members and a building that is falling apart and hiding secrets, rather than the idyllic place of his childhood.",
1996-04-21,47,10130202.0,Jack: A Night on the Town with John Barrymore,Belasco Theatre,9784.0,,22.97,40.0,426,1018,0.2092,0,2,"Nicol Williamson co-devised and starred in this one-man play, in which actor John Barrymore recites passages from some of his most legendary performances, including Richard III and Hamlet, and tells anecdotes from his colorful life.",
1996-04-21,47,10130202.0,Rent,Nederlander Theatre,456244.0,,49.9,67.5,9144,1173,0.9744,0,8,,
1996-04-28,48,10621434.0,An Ideal Husband,Ethel Barrymore Theatre,76744.0,407837.0,27.31,55.0,2810,1096,0.5128,0,5,"Sir Robert Chiltern, a newly married and upstanding politician, is threatened when a past scandal is revealed and he must turn to his old friend (who is his wife's former lover) for help, in Oscar Wilde's satire of politics and social intrigue.",
1996-05-12,50,10331272.0,Tartuffe,Circle in the Square Theatre,44555.0,,18.87,50.0,2361,724,0.5435,0,6,A religious conman infiltrates the household of a gullible man and his exasperated family in Moliere's 1664 comedy.,
1996-06-16,3,9685382.0,A Thousand Clowns,Criterion Center Stage Right,86534.0,,30.47,55.0,2840,499,0.9486,0,6,A nonconformist television writer's custody of his young nephew is threatened when the Child Welfare Bureau comes calling.,
1996-07-28,9,8966558.0,Hughie,Circle in the Square Theatre,132945.0,,54.91,55.0,2421,604,1.0021,0,4,An evening of two one-act plays: Eugene O'Neill's Hughie and David Scott Milton's Duet.,
1996-08-18,12,9418668.0,Summer and Smoke,Criterion Center Stage Right,41900.0,,33.31,55.0,1258,499,0.8403,0,3,"A repressed minister's daughter nurses a longtime unrequited love for the boy next door, who grows up into a playboy whose nature is completely at odds with hers.",
1996-09-15,16,7889390.0,Sex and Longing,Cort Theatre,74901.0,,21.56,45.0,3474,1039,0.8359,0,4,"Nymphomaniac Lulu and her gay roommate Justin have just published a coffee table book detailing their many sexual encounters, getting them into hot water with a moralistic senator's wife and minister, in Christopher Durang's comedy.",
1996-09-15,16,7889390.0,Skylight,Royale Theatre,198489.0,,29.29,55.0,6777,1058,0.8007,0,8,"On a bitterly cold London evening, schoolteacher Kyra Hollis receives an unexpected visit from her former lover, Tom Sergeant, a successful and charismatic restaurateur whose wife has recently died. As the evening progresses, the two attempt to rekindle their once passionate relationship, only to find themselves locked in a dangerous battle of opposing ideologies and mutual desires.",
1996-10-27,22,8862532.0,Chicago,Ambassador Theatre,281962.0,,46.53,70.0,6060,1362,0.7416,0,6,"A true New York City institution, Chicago has everything that makes Broadway great: a universal tale of fame, fortune and all that jazz; one show-stopping song after another; and the most astonishing dancing you’ve ever seen. Now in its 20th year on Broadway, Chicago is the longest-running American musical in Broadway history and the second longest-running Broadway production ever.",
