week_ending,week_number,weekly_gross_overall,show,theatre,weekly_gross,potential_gross,avg_ticket_price,top_ticket_price,seats_sold,seats_in_theatre,pct_capacity,performances,previews,synopsis,start_date
2013-02-24,39,18315911.0,Ann,Vivian Beaumont Theater,262436.0,926975.0,54.38,175.0,4826,1113,0.6194,0,7,,
2013-02-24,39,18315911.0,Hands on a Hardbody,Brooks Atkinson Theatre,53229.0,133996.0,57.86,197.0,920,1039,0.8855,0,1,"For ten hard-luck Texans, a new lease on life is so close they can touch it. Under a scorching sun for days on end, armed with nothing but hope, humor and ambition, they'll fight to keep at least one hand on a brand new truck in order to win it. In the hilarious, hard-fought contest that is Hands On a Hardbody, only one winner can drive away with the American Dream.",
2013-03-03,40,17192696.0,Kinky Boots,Al Hirschfeld Theatre,105384.0,177680.0,74.01,199.0,1424,1424,1.0,0,1,,
2013-03-03,40,17192696.0,Lucky Guy,Broadhurst Theatre,367156.0,294360.0,153.17,348.0,2397,1178,1.0174,0,2,"Lucky Guy dramatizes the story of tabloid columnist Mike McAlary's meteoric rise, fall and rise again, ending with his coverage of the Abner Louima case, for which he won the Pulitzer Prize.",
2013-03-10,41,18085585.0,Breakfast at Tiffany's,Cort Theatre,349270.0,801540.0,57.05,200.0,6122,1079,0.8105,0,7,"Truman Capote’s Breakfast at Tiffany’s is set in New York City in 1943. Fred, a young writer from Louisiana, meets Holly Golightly, a charming, vivacious and utterly elusive good-time girl. Everyone falls in love with Holly – including Fred. But Fred is poor, and Holly’s other suitors include a playboy millionaire and the future president of Brazil. As war rages on in Europe, Holly begins to fall in love with Fred – just as her past catches up with her.",
2013-03-10,41,18085585.0,Matilda The Musical,Sam S. Shubert Theatre,634789.0,873021.0,77.15,250.0,8228,1427,0.961,0,6,,
2013-03-10,41,18085585.0,Vanya and Sonia and Masha and Spike,John Golden Theatre,305840.0,717962.0,54.79,197.0,5582,787,0.8866,0,8,"Vanya and Sonia have never left the confines of their childhood home in Bucks County, PA, while their sister Masha has been gallivanting around the world as a successful actress. A surprise visit from Masha and her 20-something boy toy, Spike, throws the normally quiet household into utter upheaval as its residents and visitors get swept up in an intoxicating mixture of lust, rivalry, regret, and the sudden possibility of escape.",
2013-03-17,42,20821014.0,Motown The Musical,Lunt-Fontanne Theatre,1029883.0,1197030.0,97.58,225.0,10554,1465,1.0292,0,7,"Motown The Musical charts Motown Founder Berry Gordy's journey from featherweight boxer to the heavyweight music mogul who launched the careers of Diana Ross, Michael Jackson, Stevie Wonder, Smokey Robinson, Marvin Gaye and many more.",
2013-03-24,43,21709084.0,Pippin,Music Box Theatre,199935.0,228948.0,101.28,225.0,1974,994,0.993,0,2,"The young son of the medieval French ruler Charlemange is encouraged by a flashy troupe of strolling players to try his hand at war, love, and other joys before settling down.",
2013-03-24,43,21709084.0,The Assembled Parties,Samuel J. Friedman Theatre,109183.0,356925.0,44.13,,2474,650,0.7612,0,5,"The Assembled Parties is about the Bascovs, an Upper West Side Jewish family in 1980. Former movie star Julie Bascov and her sister-in-law Faye bring their families together for their traditional holiday dinner, where a house guest insinuates himself into the family drama. Twenty years later, as 2001 approaches, the Bascovs' seemingly picture-perfect life may be about to crumble.",
2013-03-24,43,21709084.0,The Big Knife,American Airlines Theatre,105646.0,346075.0,37.74,,2799,740,0.7565,0,5,"A movie studio uses blackmail and other dastardly actions to keep its latest star under long-term contract, though he would rather get out of town.",
2013-03-24,43,21709084.0,The Nance,Lyceum Theatre,199627.0,373840.0,71.42,,2795,916,0.7628,0,4,"The Nance tells the story of Chauncey Miles, a headline nance performer in New York burlesque, who also happens to be a homosexual. Playwright Douglas Carter Beane paints the portrait of a homosexual man living and working in the secretive and dangerous gay world of 1930s New York.",
2013-03-31,44,28531069.0,Orphans,Gerald Schoenfeld Theatre,659391.0,1025750.0,81.76,225.0,8065,1071,0.9413,0,8,,
2013-03-31,44,28531069.0,The Testament of Mary,Walter Kerr Theatre,191134.0,631440.0,47.89,225.0,3991,943,0.7054,0,6,"Colm Tóibín's The Testament of Mary takes place after the Crucifixion. Mary, the mother of Jesus, is in the city of Ephesus where she is both guarded and protected. As two of her son's followers set about giving shape to Jesus’ story, Mary tells her own story - the one which has not been heard.",
2013-03-31,44,28531069.0,The Trip to Bountiful,Stephen Sondheim Theatre,161233.0,257030.0,82.77,250.0,1948,1063,0.9163,0,2,"An aging widow leaves her son and daughter in a small Houston apartment to visit the home where she grew up. There in Bountiful, TX, she hopes to regain her dignity and peace of mind.",
2013-04-07,45,25899689.0,I'll Eat You Last: A Chat With Sue Mengers,Booth Theatre,313705.0,305610.0,133.78,298.0,2345,782,0.9996,0,3,"Appearing on Broadway for the first time in 30 years, Bette Midler will play the legendary Hollywood agent Sue Mengers (1932-2011) in John Logan's new, one-character play.",
2013-04-21,47,24719511.0,The Rascals: Once Upon a Dream,Richard Rodgers Theatre,646622.0,835825.0,109.8,298.0,5889,1339,0.8796,4,1,"The Rascals will present a concert performance of songs that captured the spirit of America in the 1960s, such as their smash hits “Good Lovin’, “Lonely Too Long, “It’s a Beautiful Morning, “How Can I Be Sure and “Groovin’.",
2013-07-14,7,23190353.0,First Date,Longacre Theatre,408245.0,871427.0,52.23,197.0,7817,1069,0.9141,0,8,"When tightly wound Aaron is set up with cool girl Casey, a quick drink turns into a hilarious dinner served with sides of Google background checks, fake emergency phone calls, a slew of bad boy and uptown girl exes, and some seriously saucy chemistry. Can this mismatched pair turn what could be a dining disaster into something special before the check arrives, or end up at another table for one?",
2013-07-21,8,23614761.0,Let It Be,St. James Theatre,399319.0,1300510.0,41.9,199.0,9530,1683,0.7078,0,8,"Let It Be showcases the works of The Beatles, using video footage to tell the story of the band’s meteoric rise from their humble beginnings in Liverpool’s Cavern Club, through the heights of Beatlemania, to their later studio masterpieces.",
2013-07-21,8,23614761.0,Soul Doctor,Circle in the Square Theatre,109750.0,464170.0,36.71,200.0,2990,698,0.8567,0,5,"Soul Doctor tells the story of the beloved yet controversial father of popular Jewish music, Rabbi Shlomo Carlebach.",
2013-08-25,13,20604712.0,Romeo and Juliet,Richard Rodgers Theatre,207375.0,319700.0,86.77,223.0,2390,1310,0.9122,0,2,,
2013-09-08,15,18374971.0,Big Fish,Neil Simon Theatre,383543.0,661384.0,69.48,200.0,5520,1367,1.0095,0,4,,
2013-09-22,17,19497282.0,A Night With Janis Joplin,Lyceum Theatre,144461.0,235440.0,77.83,197.0,1856,682,0.9071,0,3,A Night With Janis Joplin is a musical journey celebrating the inspirations of one of Rock ‘n’ Roll’s greatest legends.,
2013-09-22,17,19497282.0,The Winslow Boy,American Airlines Theatre,88627.0,423850.0,37.52,,2362,740,0.6384,0,5,"In Terence Rattigan's play, based on a real-life incident, an English father fights to clear his son's name after he is expelled from boarding school, accused of stealing a five-shilling postal order.",
2013-09-29,18,19453422.0,A Time to Kill,John Golden Theatre,54952.0,92158.0,70.81,223.0,776,802,0.9676,0,1,"A Time to Kill tells the story of a young, idealistic lawyer, Jack Brigance, defending a black man, Carl Lee Hailey, for taking the law into his own hands following an unspeakable crime committed against his young daughter.",
2013-10-06,19,21422658.0,The Snow Geese,Samuel J. Friedman Theatre,200041.0,518000.0,54.2,,3691,650,0.8112,0,7,"With World War I raging abroad, newly widowed Elizabeth Gaesling  gathers her family for their annual shooting party to mark the opening of hunting season in rural, upstate New York. But Elizabeth is forced to confront a new reality as her carefree eldest son comes to terms with his impending deployment overseas and her younger son discovers that the father they all revered left them deeply in debt.",
2013-10-20,21,24038298.0,After Midnight,Brooks Atkinson Theatre,235823.0,369606.0,79.45,197.0,2968,1014,0.9757,0,3,,
2013-10-20,21,24038298.0,Twelfth Night / Richard III,Belasco Theatre,468429.0,640530.0,76.43,197.0,6129,1051,0.9719,0,6,,
2013-10-27,22,23158296.0,A Gentleman's Guide to Love and Murder,Walter Kerr Theatre,311467.0,724541.0,63.66,250.0,4893,849,0.8233,0,7,"When Monty Navarro, the black sheep of the D'Ysquith family, finds out he is ninth in line to inherit a dukedom, he decides to eliminate the other eight heirs standing in his way.",
2013-10-27,22,23158296.0,No Man's Land / Waiting for Godot,Cort Theatre,202787.0,238490.0,102.11,223.0,1986,1073,0.9254,0,2,,
2013-11-17,25,24670333.0,Il Divo - A Musical Affair: The Greatest Songs of Broadway,Marquis Theatre,1308223.0,1315320.0,141.57,300.0,9241,1612,0.9554,6,0,"Il Divo, the operatic vocal group created by Simon Cowell, will offer songs from such shows as The Phantom of the Opera, Carousel and West Side Story.",
2013-11-24,26,23426996.0,Beautiful: The Carole King Musical,Stephen Sondheim Theatre,507431.0,645110.0,116.41,450.0,4359,1026,0.8497,0,5,"Beautiful tells the story of Carole King’s remarkable rise to stardom, from being part of a hit songwriting team with her husband Gerry Goffin, to her relationship with fellow writers and best friends Cynthia Weil and Barry Mann, to becoming one of the most successful solo acts in popular music history.",
2013-12-22,30,27539205.0,Machinal,American Airlines Theatre,70446.0,332580.0,35.01,,2012,727,0.6919,0,4,,
2014-01-05,32,31143671.0,Outside Mullingar,Samuel J. Friedman Theatre,116334.0,296000.0,55.98,,2078,650,0.7992,0,4,"Outside Mullingar is about Anthony and Rosemary, two introverted misfits straddling 40. Anthony has spent his entire life on a cattle farm in rural Ireland. Rosemary lives right next door, determined to have him, watching the years slip away. With Anthony’s father threatening to disinherit him and a land feud simmering between their families, Rosemary has every reason to fear romantic catastrophe. But these yearning, eccentric souls fight their way towards solid ground and some kind of happiness.",
2014-01-12,33,19579702.0,Bronx Bombers,Circle in the Square Theatre,128209.0,378420.0,75.77,227.0,1692,772,0.5479,0,4,"Ruth. Berra. Mantle. DiMaggio. Gehrig. Jeter. The New York Yankees have never had a shortage of star playersâ€¦ or controversy. Bronx Bombers follows beloved icon Yogi Berra and his wife Carmen through a century of the team's trials and triumphs, bringing generations of Yankee greats together on one stage.",
2014-01-19,34,20091734.0,The Bridges of Madison County,Gerald Schoenfeld Theatre,212261.0,393816.0,76.27,223.0,2783,1019,0.9104,0,3,"Set amidst the cornfields and picturesque covered bridges of Iowa in 1965, the musical follows an Italian war-bride whose safe but passionless world is shattered when she encounters a roving National Geographic photographer.",
2014-02-16,38,21192765.0,All The Way,Neil Simon Theatre,770789.0,1381980.0,94.14,225.0,8188,1428,0.7167,0,8,The sudden death of a Southern husband and father and its effect on his family is the subject of Tad Mosel's Pulitzer Prize-winning adaptation of James Agee's Pulitzer Prize-winning novel A Death in the Family.,
2014-02-16,38,21192765.0,Rocky,Winter Garden Theatre,373672.0,552567.0,95.69,248.0,3905,1532,0.8497,0,3,,
2014-02-23,39,20540286.0,Mothers and Sons,John Golden Theatre,29638.0,99702.0,61.11,225.0,485,802,0.6047,0,1,"Mothers and Sons is about a mother who pays a surprise visit to the New York apartment of her late son’s ex-partner, who is now married to another man and has a young son.  Challenged to face how society has changed around her—without her—she is finally able to see the rich life her son might have led.",
2014-03-02,40,18500516.0,Aladdin,New Amsterdam Theatre,691812.0,739595.0,80.44,199.5,8600,1720,1.0,0,5,"From the producer of The Lion King and the director/choreographer of The Book of Mormon and Something Rotten! (Casey Nicholaw) comes the timeless story of Aladdin in a thrilling new production filled with unforgettable beauty, magic, comedy and breathtaking spectacle. It’s an extraordinary theatrical event where one lamp and three wishes make the possibilities infinite.",
2014-03-09,41,21278718.0,If/Then,Richard Rodgers Theatre,909159.0,1097950.0,106.94,223.0,8502,1275,0.9526,0,7,"If/Then is a contemporary musical that follows Elizabeth as she rebuilds her life in New York, a city of infinite possibilities.  By the Pulitzer Prize and Tony Award-winning creators of Next to Normal, If/Then is an original new musical set at the intersection of choice and chance, where the road you take meets the road you didn’t.",
2014-03-16,42,24465471.0,Bullets Over Broadway,St. James Theatre,655710.0,1137030.0,72.45,252.0,9050,1630,0.9254,0,6,"Bullets Over Broadway, a musical adaptation of Woody Allen's Academy Award-nominated film of the same name, is about a playwright whose first taste of success comes with mobsters and a domineering diva attached.",
2014-03-16,42,24465471.0,The Realistic Joneses,Lyceum Theatre,253222.0,362864.0,89.13,223.0,2841,872,0.8145,0,4,"In The Realistic Joneses, we meet Bob and Jennifer and their new neighbors, John and Pony, two suburban couples who have even more in common than their identical homes and their shared last names. As their relationships begin to irrevocably intertwine, the Joneses must decide between their idyllic fantasies and their imperfect realities.",
2014-03-23,43,26493585.0,Act One,Vivian Beaumont Theater,152704.0,513600.0,57.67,,2648,1084,0.6107,0,4,,
2014-03-23,43,26493585.0,Of Mice and Men,Longacre Theatre,688832.0,712114.0,111.95,223.0,6153,1073,0.9557,0,6,"Two migrant field hands, the average-looking but smart George and the strong but mentally challenged Lennie, find work on a farm in California during the Great Depression, seeing their dreams lead to tragedy when Lennie gets too close to the wife of the boss's son, in John Steinbeck's adaptation of his novel.",
2014-03-30,44,29088089.0,Hedwig and the Angry Inch,Belasco Theatre,144194.0,119809.0,141.92,248.0,1016,1002,1.014,0,1,"Hedwig and the Angry Inch is a rock musical about a fictional rock and roll band, the Angry Inch, fronted by Hedwig - an East German transgender singer.",
2014-03-30,44,29088089.0,Lady Day at Emerson's Bar and Grill,Circle in the Square Theatre,337951.0,623450.0,84.36,250.0,4006,682,0.8391,0,7,"The time is 1959. The place is a seedy bar in Philadelphia. The audience is about to witness one of Billie Holiday's last performances, given four months before her death. More than a dozen musical numbers are interlaced with salty, often humorous, reminiscences to project a riveting portrait of the lady and her music.",
2014-03-30,44,29088089.0,Violet,American Airlines Theatre,169792.0,381056.0,60.53,,2805,727,0.9646,0,4,A young publisher struggles to choose his next project while dealing with the appearance of a strange machine that spits out manuscript pages with information about his future.,
2014-04-06,45,26873434.0,Casa Valentina,Samuel J. Friedman Theatre,155775.0,512834.0,45.2,,3446,650,0.7574,0,7,"Back in 1962, most men went to the Catskill Mountains to escape the summer heat, but others took the two-hour drive to escape something else entirely: being men. Nestled in the land of dirty dancing and borscht belt comedy sat an inconspicuous bungalow colony that catered to a very special clientele: heterosexual men whose favorite pastime was dressing and acting as women.",
2014-04-06,45,26873434.0,The Velocity of Autumn,Booth Theatre,135307.0,669898.0,39.96,173.0,3386,778,0.6217,0,7,"Alexandra is a 79-year-old artist in a showdown with her family over where she'll spend her remaining years. In Alexandra's corner are her wit, her volcanic passion and the fact that she's barricaded herself in her Brooklyn brownstone with a pile of Molotov cocktails. When Alexandra's estranged son Chris returns after 20 years and crawls through her second floor window, the emotional bombs start detonating.",
2014-04-13,46,28579887.0,The Cripple of Inishmaan,Cort Theatre,155234.0,163830.0,72.78,248.0,2133,1073,0.9939,0,2,"Set on the remote island of Inishmaan off the west coast of Ireland, word arrives that a Hollywood film is being made on the neighboring island of Inishmore. The one person who wants to be in the film more than anybody is young Cripple Billy, if only to break away from the bitter tedium of his daily life.",
2014-06-08,2,28348062.0,Holler If Ya Hear Me,Palace Theatre,148964.0,784072.0,24.1,173.0,6182,1088,0.8117,0,7,"Inner city lives struggle for peace against the daily challenges they face in Holler If Ya Hear Me, a musical inspired by the music and lyrics of late rapper Tupac Shakur.",
2014-08-24,13,22786507.0,This Is Our Youth,Cort Theatre,365614.0,628232.0,63.34,223.0,5772,1061,0.7772,0,7,"Set in New York in 1982, This Is Our Youth follows forty-eight hours in the lives of three very lost young souls: Warren, a dejected nineteen year old who has just stolen $15,000 from his abusive, tycoon father; Dennis, his charismatic drug-dealing friend who helps Warren put the stolen money to good use; and Jessica, the anxiously insightful young woman who Warren yearns for.",
2014-08-31,14,22905607.0,It's Only a Play,Bernard B. Jacobs Theatre,793046.0,705250.0,146.81,225.0,5402,1069,1.0107,0,5,"It’s opening night of Peter Austin's new play as he anxiously awaits to see if his show is a hit. With his career on the line, he shares his big First Night with his best friend, a television star, his fledgling producer, his erratic leading lady, his wunderkind director, an infamous drama critic, and a wide-eyed coat check attendant on his first night in Manhattan. It’s alternately raucous, ridiculous and tender — reminding audiences why there’s no business like show business.",
2014-08-31,14,22905607.0,You Can't Take It With You,Longacre Theatre,519102.0,964892.0,65.47,250.0,7929,1073,0.9237,0,8,"An eccentric family allows each member to pursue his own ambition in the home, but their routine is disrupted when a daughter with a regular job wants to bring her fiancé and his Wall Street family to dinner in George S. Kaufman and Moss Hart's Pulitzer Prize-winning comedy.",
2014-09-14,16,22291146.0,The Country House,Samuel J. Friedman Theatre,198383.0,518000.0,53.56,,3704,650,0.8141,0,7,,
2014-09-14,16,22291146.0,The Curious Incident of the Dog in the Night-Time,Ethel Barrymore Theatre,288614.0,439376.0,75.93,195.0,3801,1018,0.9334,0,4,,
2014-09-28,18,22181017.0,Disgraced,Lyceum Theatre,100824.0,200314.0,63.69,198.0,1583,918,0.8622,0,2,"Disgraced is the story of a successful Muslim-American lawyer and his wife – an artist influenced by Islamic imagery – enjoying their comfortable life on New York’s Upper East Side. When a co-worker and her husband come to dinner, what begins as polite table conversation explodes, leaving everyone’s relationships and beliefs about race and identity in shards.",
2014-10-05,19,23249659.0,The Last Ship,Neil Simon Theatre,533382.0,1079855.0,78.68,225.0,6779,1344,0.7206,0,7,,
2014-11-02,23,23464674.0,The River,Circle in the Square Theatre,348102.0,327834.0,161.01,275.0,2162,696,1.0354,0,3,"A black poet is forced to paint houses to provide for his family in Harlem.  That family's history, including his son's decision to leave the Air Force and the street life for law school, is the subject of Joseph A. Walker's play.",
2014-11-23,26,26699452.0,Honeymoon in Vegas,Nederlander Theatre,366136.0,983218.0,69.24,223.0,5288,1157,0.6529,0,7,"Honeymoon in Vegas tells the story of Jack Singer, a regular guy with an extraordinary fear of marriage, who finally gets up the nerve to ask his girlfriend Betsy to marry him. But when they head to Las Vegas to get hitched, smooth talking gambler Tommy Korman, looking for a second chance at love, falls head over heels for Betsy. What happens next is anybody's bet!",
2014-11-30,27,34121647.0,The Illusionists - Witness the Impossible,Marquis Theatre,1048858.0,1378870.0,107.44,175.0,9762,1565,0.8911,0,7,"Seven illusionists enact mind-bending acts of magic and illusion, many of which have never been seen before.",
2014-12-21,30,31278714.0,Constellations,Samuel J. Friedman Theatre,325875.0,679684.0,82.44,,3953,650,0.8688,0,7,"One relationship. Infinite possibilities. An explosive new play about the boundless potential of a first encounter, free will, and friendship.",
2015-01-04,32,42773882.0,The Temptations & The Four Tops On Broadway,Palace Theatre,819461.0,1293810.0,93.33,240.0,8780,1679,0.747,7,0,"Both a career retrospective as well as a celebration of the hit songs that defined a generation, this special one-week Broadway engagement of The Temptations and The Four Tops will feature the legendary Hall of Fame artists performing all their classic Top 10 Billboard hits in a once-in-a-lifetime Broadway event.",
2015-02-08,37,18766305.0,Fish in the Dark,Cort Theatre,993940.0,876585.0,130.95,423.0,7590,1073,1.0105,0,7,"Larry David makes his Broadway debut as an actor and playwright with his first play Fish in the Dark, inspired by the death of a friend's father.",
2015-02-15,38,22494434.0,On the Twentieth Century,American Airlines Theatre,228661.0,401500.0,80.04,,2857,740,0.9652,0,4,"A down-and-out Broadway producer struggles to convince his former muse and lover, now a successful film actress, to return to Broadway in a play about Mary Magdelene, while dealing with her jealous new lover and a religious fanatic aboard a luxury train, in Cy Coleman, Betty Comden and Adolph Green's musical adaptation of the play Twentieth Century.",
2015-02-15,38,22494434.0,The Audience,Gerald Schoenfeld Theatre,331101.0,297728.0,153.22,293.0,2161,1069,1.0108,0,2,,
2015-03-01,40,18617254.0,The Heidi Chronicles,Music Box Theatre,305345.0,891192.0,51.05,223.0,5981,1001,0.7469,0,8,"A feminist art historian and her friends, male and female, gay and straight, mature from the 1960s to the 1980s as they search for political, professional and personal fulfillment, in Wendy Wasserstein's Pulitzer Prize and Tony Award-winning play.",
2015-03-15,42,22954554.0,An American in Paris,Palace Theatre,317918.0,367330.0,100.58,223.0,3161,1601,0.9872,0,2,,
2015-03-15,42,22954554.0,Finding Neverland,Lunt-Fontanne Theatre,159823.0,186055.0,105.84,225.0,1510,1479,1.021,0,1,"Based on the Miramax motion picture by David Magee and the play The Man Who Was Peter Pan by Allan Knee, Finding Neverland follows the relationship between playwright J. M. Barrie and the family that inspired Peter Pan, or The Boy Who Wouldn't Grow Up – one of the most beloved stories of all time.",
2015-03-15,42,22954554.0,Hand to God,Booth Theatre,36122.0,78488.0,47.03,223.0,768,782,0.9821,0,1,"Shy, inquisitive student Jason finds an outlet for his burgeoning creativity at the Christian Puppet Ministry in the devoutly religious, relatively quiet small town of Cypress, Texas, until his hand puppet Tyrone — once soft-spoken — takes on a shocking and dangerously irreverent personality all its own. As Tyrone’s influence over Jason steadily grows, Hand to God explores the startlingly fragile nature of faith, morality, and the ties that bind us.""",
2015-03-22,43,26316785.0,Gigi,Neil Simon Theatre,331484.0,690800.0,77.25,198.0,4291,1356,0.7911,0,4,,
2015-03-22,43,26316785.0,It Shoulda Been You,Brooks Atkinson Theatre,293768.0,713724.0,57.49,197.0,5110,978,0.8708,0,6,"The bride is Jewish.  The groom is Catholic.  Her mother is a force of nature, his mother is a tempest in a cocktail shaker. And when the bride’s ex-boyfriend shows up, the perfect wedding starts to unravel faster than you can whistle “Here Comes the Bride!  Plots are hatched, pacts are made, secrets exposed – and the sister of the bride is left to turn a tangled mess into happily ever after!",
2015-03-22,43,26316785.0,Wolf Hall: Parts 1 & 2,Winter Garden Theatre,419780.0,714787.0,99.66,293.5,4212,1383,0.7614,0,4,"Wolf Hall: Parts 1 & 2 are adapted by Mike Poulton from Hilary Mantel’s Man Booker Prize-winning novels, Wolf Hall and Bring Up the Bodies. The plays are based on the deceit, betrayal, and intrigue of the court of Henry VIII.",
2015-03-29,44,27962548.0,Doctor Zhivago,Broadway Theatre,291270.0,482320.0,74.02,247.0,3935,1478,0.8875,0,3,"Doctor Zhivago is an epic romance set during the final days of Czarist Russia, the First World War, and the chaos of the Russian revolution. Raised as an aristocrat, Zhivago is a political idealist, physician, and poet who is torn between a life with his devoted wife, Tonia Gromeko, and the passionate and mysterious Lara Guishar. Zhivago is not alone in his yearnings for Lara, competing for her affections with the young revolutionary Pasha Antipov and the aristocrat Viktor Komarovsky.",
2015-03-29,44,27962548.0,Fun Home,Circle in the Square Theatre,218509.0,373144.0,77.43,200.0,2822,702,1.005,0,4,"After her father dies unexpectedly, Alison dives deep into her past to tell the story of the volatile, brilliant, one-of-a-kind man whose temperament and secrets defined her family and her life. Based on Alison Bechdel’s autobiographical graphic novel.",
